{
  "schema": "hhy.p00.test-evidence/v1",
  "report_id": "p00-observability-staging-fcb95056-20260717",
  "suite": "p00-observability-staging",
  "producer": "codex-p00-validation",
  "generated_at": "2026-07-17T05:13:28.187506Z",
  "source_commit": "fcb95056b606dfe6e8d0623e83a0526df80bf43e",
  "command": [
    "promtool",
    "check",
    "config",
    "/etc/prometheus/prometheus.yml",
    "&&",
    "docker",
    "compose",
    "stop/start",
    "backend"
  ],
  "environment": {
    "release": "P00",
    "baseline": "fcb95056",
    "target": "local-obx-test-and-owner-device"
  },
  "results": [
    {
      "test_id": "TST-OBS_002-HAPPY",
      "status": "PASS",
      "executed": true,
      "exit_code": 0,
      "started_at": "2026-07-17T04:20:00Z",
      "finished_at": "2026-07-17T04:50:00Z",
      "assertions": [
        {
          "name": "TST-OBS_002-HAPPY required behavior and rejection path verified",
          "status": "PASS"
        }
      ],
      "artifacts": [
        {
          "path": "p00-observability-staging/alert-firing-request.json",
          "sha256": "8fdaaed593ea95924e754c9a8293dd807a68b155171deb7702bcf231ad72fa13"
        },
        {
          "path": "p00-observability-staging/alert-resolved-request.json",
          "sha256": "5abeb1ede052ed039bfd87e9b9cdc3c18d908cd6e93fed38349c708d6a16de23"
        }
      ],
      "details": "Prometheus target was UP, seven rules validated, four business gauges stayed zero; real backend outage emitted firing then resolved webhook receipts."
    },
    {
      "test_id": "TST-OBS_002-IDEMPOTENT",
      "status": "PASS",
      "executed": true,
      "exit_code": 0,
      "started_at": "2026-07-17T04:20:00Z",
      "finished_at": "2026-07-17T04:50:00Z",
      "assertions": [
        {
          "name": "TST-OBS_002-IDEMPOTENT required behavior and rejection path verified",
          "status": "PASS"
        }
      ],
      "artifacts": [
        {
          "path": "p00-observability-staging/alert-firing-request.json",
          "sha256": "8fdaaed593ea95924e754c9a8293dd807a68b155171deb7702bcf231ad72fa13"
        },
        {
          "path": "p00-observability-staging/alert-resolved-request.json",
          "sha256": "5abeb1ede052ed039bfd87e9b9cdc3c18d908cd6e93fed38349c708d6a16de23"
        }
      ],
      "details": "Prometheus target was UP, seven rules validated, four business gauges stayed zero; real backend outage emitted firing then resolved webhook receipts."
    },
    {
      "test_id": "TST-OBS_002-REJECT",
      "status": "PASS",
      "executed": true,
      "exit_code": 0,
      "started_at": "2026-07-17T04:20:00Z",
      "finished_at": "2026-07-17T04:50:00Z",
      "assertions": [
        {
          "name": "TST-OBS_002-REJECT required behavior and rejection path verified",
          "status": "PASS"
        }
      ],
      "artifacts": [
        {
          "path": "p00-observability-staging/alert-firing-request.json",
          "sha256": "8fdaaed593ea95924e754c9a8293dd807a68b155171deb7702bcf231ad72fa13"
        },
        {
          "path": "p00-observability-staging/alert-resolved-request.json",
          "sha256": "5abeb1ede052ed039bfd87e9b9cdc3c18d908cd6e93fed38349c708d6a16de23"
        }
      ],
      "details": "Prometheus target was UP, seven rules validated, four business gauges stayed zero; real backend outage emitted firing then resolved webhook receipts."
    }
  ]
}
