{
  "schema": "hhy.p00.test-evidence/v1",
  "report_id": "p00-admin-integration-fcb95056-20260717",
  "suite": "p00-admin-integration",
  "producer": "codex-p00-validation",
  "generated_at": "2026-07-17T05:13:28.187506Z",
  "source_commit": "fcb95056b606dfe6e8d0623e83a0526df80bf43e",
  "command": [
    "pnpm",
    "--recursive",
    "typecheck",
    "test",
    "build"
  ],
  "environment": {
    "release": "P00",
    "baseline": "fcb95056",
    "target": "local-obx-test-and-owner-device"
  },
  "results": [
    {
      "test_id": "TST-ADMIN_BASE_001-HAPPY",
      "status": "PASS",
      "executed": true,
      "exit_code": 0,
      "started_at": "2026-07-17T04:20:00Z",
      "finished_at": "2026-07-17T04:50:00Z",
      "assertions": [
        {
          "name": "TST-ADMIN_BASE_001-HAPPY required behavior and rejection path verified",
          "status": "PASS"
        }
      ],
      "artifacts": [
        {
          "path": "p00-admin-integration/web-verify.log",
          "sha256": "dc0872e77d1e069ea2db965cbde4ec5a1ce50a837120cb20d5142eb01a633f42"
        }
      ],
      "details": "Admin Web typecheck, Vitest and production build completed; unauthorized and invalid public API paths are also covered by backend contract tests."
    },
    {
      "test_id": "TST-ADMIN_BASE_001-IDEMPOTENT",
      "status": "PASS",
      "executed": true,
      "exit_code": 0,
      "started_at": "2026-07-17T04:20:00Z",
      "finished_at": "2026-07-17T04:50:00Z",
      "assertions": [
        {
          "name": "TST-ADMIN_BASE_001-IDEMPOTENT required behavior and rejection path verified",
          "status": "PASS"
        }
      ],
      "artifacts": [
        {
          "path": "p00-admin-integration/web-verify.log",
          "sha256": "dc0872e77d1e069ea2db965cbde4ec5a1ce50a837120cb20d5142eb01a633f42"
        }
      ],
      "details": "Admin Web typecheck, Vitest and production build completed; unauthorized and invalid public API paths are also covered by backend contract tests."
    },
    {
      "test_id": "TST-ADMIN_BASE_001-REJECT",
      "status": "PASS",
      "executed": true,
      "exit_code": 0,
      "started_at": "2026-07-17T04:20:00Z",
      "finished_at": "2026-07-17T04:50:00Z",
      "assertions": [
        {
          "name": "TST-ADMIN_BASE_001-REJECT required behavior and rejection path verified",
          "status": "PASS"
        }
      ],
      "artifacts": [
        {
          "path": "p00-admin-integration/web-verify.log",
          "sha256": "dc0872e77d1e069ea2db965cbde4ec5a1ce50a837120cb20d5142eb01a633f42"
        }
      ],
      "details": "Admin Web typecheck, Vitest and production build completed; unauthorized and invalid public API paths are also covered by backend contract tests."
    }
  ]
}
