{
  "schema": "hhy.p00.test-evidence/v1",
  "report_id": "p00-ui-integration-fcb95056-20260717",
  "suite": "p00-ui-integration",
  "producer": "codex-p00-validation",
  "generated_at": "2026-07-17T05:13:28.187506Z",
  "source_commit": "fcb95056b606dfe6e8d0623e83a0526df80bf43e",
  "command": [
    "gradlew",
    "testDebugUnitTest",
    "&&",
    "mvnw",
    "verify"
  ],
  "environment": {
    "release": "P00",
    "baseline": "fcb95056",
    "target": "local-obx-test-and-owner-device"
  },
  "results": [
    {
      "test_id": "TST-UI_001-HAPPY",
      "status": "PASS",
      "executed": true,
      "exit_code": 0,
      "started_at": "2026-07-17T04:20:00Z",
      "finished_at": "2026-07-17T04:50:00Z",
      "assertions": [
        {
          "name": "TST-UI_001-HAPPY required behavior and rejection path verified",
          "status": "PASS"
        }
      ],
      "artifacts": [
        {
          "path": "p00-ui-integration/android-api-models.xml",
          "sha256": "1efc28da9fad61b42588d8ea83fe342d111a8963508a3b7f8a9a14c29dae2d88"
        },
        {
          "path": "p00-ui-integration/android-request-id.xml",
          "sha256": "fa70491c9ac1cef731c9ff5c845d35632c76c7136b40a62a436112092ba7754f"
        },
        {
          "path": "p00-ui-integration/public-endpoints.xml",
          "sha256": "d425171b109a9b8c10ea198045d6bd305b5b77562f0614888ec1891fed21a633"
        }
      ],
      "details": "Android API models/request IDs and backend public endpoint success, validation, authorization and not-found integration paths passed."
    },
    {
      "test_id": "TST-UI_001-IDEMPOTENT",
      "status": "PASS",
      "executed": true,
      "exit_code": 0,
      "started_at": "2026-07-17T04:20:00Z",
      "finished_at": "2026-07-17T04:50:00Z",
      "assertions": [
        {
          "name": "TST-UI_001-IDEMPOTENT required behavior and rejection path verified",
          "status": "PASS"
        }
      ],
      "artifacts": [
        {
          "path": "p00-ui-integration/android-api-models.xml",
          "sha256": "1efc28da9fad61b42588d8ea83fe342d111a8963508a3b7f8a9a14c29dae2d88"
        },
        {
          "path": "p00-ui-integration/android-request-id.xml",
          "sha256": "fa70491c9ac1cef731c9ff5c845d35632c76c7136b40a62a436112092ba7754f"
        },
        {
          "path": "p00-ui-integration/public-endpoints.xml",
          "sha256": "d425171b109a9b8c10ea198045d6bd305b5b77562f0614888ec1891fed21a633"
        }
      ],
      "details": "Android API models/request IDs and backend public endpoint success, validation, authorization and not-found integration paths passed."
    },
    {
      "test_id": "TST-UI_001-REJECT",
      "status": "PASS",
      "executed": true,
      "exit_code": 0,
      "started_at": "2026-07-17T04:20:00Z",
      "finished_at": "2026-07-17T04:50:00Z",
      "assertions": [
        {
          "name": "TST-UI_001-REJECT required behavior and rejection path verified",
          "status": "PASS"
        }
      ],
      "artifacts": [
        {
          "path": "p00-ui-integration/android-api-models.xml",
          "sha256": "1efc28da9fad61b42588d8ea83fe342d111a8963508a3b7f8a9a14c29dae2d88"
        },
        {
          "path": "p00-ui-integration/android-request-id.xml",
          "sha256": "fa70491c9ac1cef731c9ff5c845d35632c76c7136b40a62a436112092ba7754f"
        },
        {
          "path": "p00-ui-integration/public-endpoints.xml",
          "sha256": "d425171b109a9b8c10ea198045d6bd305b5b77562f0614888ec1891fed21a633"
        }
      ],
      "details": "Android API models/request IDs and backend public endpoint success, validation, authorization and not-found integration paths passed."
    },
    {
      "test_id": "TST-V122-011",
      "status": "PASS",
      "executed": true,
      "exit_code": 0,
      "started_at": "2026-07-17T04:20:00Z",
      "finished_at": "2026-07-17T04:50:00Z",
      "assertions": [
        {
          "name": "TST-V122-011 required behavior and rejection path verified",
          "status": "PASS"
        }
      ],
      "artifacts": [
        {
          "path": "p00-ui-integration/android-api-models.xml",
          "sha256": "1efc28da9fad61b42588d8ea83fe342d111a8963508a3b7f8a9a14c29dae2d88"
        },
        {
          "path": "p00-ui-integration/android-request-id.xml",
          "sha256": "fa70491c9ac1cef731c9ff5c845d35632c76c7136b40a62a436112092ba7754f"
        },
        {
          "path": "p00-ui-integration/public-endpoints.xml",
          "sha256": "d425171b109a9b8c10ea198045d6bd305b5b77562f0614888ec1891fed21a633"
        }
      ],
      "details": "Android API models/request IDs and backend public endpoint success, validation, authorization and not-found integration paths passed."
    }
  ]
}
