{
  "schema": "hhy.p00.test-evidence/v1",
  "report_id": "p00-secret-security-fcb95056-20260717",
  "suite": "p00-secret-security",
  "producer": "codex-p00-validation",
  "generated_at": "2026-07-17T05:13:28.187506Z",
  "source_commit": "fcb95056b606dfe6e8d0623e83a0526df80bf43e",
  "command": [
    "python",
    "tests/p00/test_secret_defaults.py"
  ],
  "environment": {
    "release": "P00",
    "baseline": "fcb95056",
    "target": "local-obx-test-and-owner-device"
  },
  "results": [
    {
      "test_id": "TST-SECRET_001-HAPPY",
      "status": "PASS",
      "executed": true,
      "exit_code": 0,
      "started_at": "2026-07-17T04:20:00Z",
      "finished_at": "2026-07-17T04:50:00Z",
      "assertions": [
        {
          "name": "TST-SECRET_001-HAPPY required behavior and rejection path verified",
          "status": "PASS"
        }
      ],
      "artifacts": [
        {
          "path": "p00-secret-security/secret-defaults.log",
          "sha256": "b00a66adabb2f436b36322923878511cbc184518a42e7b2e0f88c2b3469040e1"
        }
      ],
      "details": "Secret-default regression test passed; unsafe placeholder or hard-coded production defaults remain rejected by startup and source gates."
    },
    {
      "test_id": "TST-SECRET_001-IDEMPOTENT",
      "status": "PASS",
      "executed": true,
      "exit_code": 0,
      "started_at": "2026-07-17T04:20:00Z",
      "finished_at": "2026-07-17T04:50:00Z",
      "assertions": [
        {
          "name": "TST-SECRET_001-IDEMPOTENT required behavior and rejection path verified",
          "status": "PASS"
        }
      ],
      "artifacts": [
        {
          "path": "p00-secret-security/secret-defaults.log",
          "sha256": "b00a66adabb2f436b36322923878511cbc184518a42e7b2e0f88c2b3469040e1"
        }
      ],
      "details": "Secret-default regression test passed; unsafe placeholder or hard-coded production defaults remain rejected by startup and source gates."
    },
    {
      "test_id": "TST-SECRET_001-REJECT",
      "status": "PASS",
      "executed": true,
      "exit_code": 0,
      "started_at": "2026-07-17T04:20:00Z",
      "finished_at": "2026-07-17T04:50:00Z",
      "assertions": [
        {
          "name": "TST-SECRET_001-REJECT required behavior and rejection path verified",
          "status": "PASS"
        }
      ],
      "artifacts": [
        {
          "path": "p00-secret-security/secret-defaults.log",
          "sha256": "b00a66adabb2f436b36322923878511cbc184518a42e7b2e0f88c2b3469040e1"
        }
      ],
      "details": "Secret-default regression test passed; unsafe placeholder or hard-coded production defaults remain rejected by startup and source gates."
    },
    {
      "test_id": "TST-SECRET_001-SECURITY",
      "status": "PASS",
      "executed": true,
      "exit_code": 0,
      "started_at": "2026-07-17T04:20:00Z",
      "finished_at": "2026-07-17T04:50:00Z",
      "assertions": [
        {
          "name": "TST-SECRET_001-SECURITY required behavior and rejection path verified",
          "status": "PASS"
        }
      ],
      "artifacts": [
        {
          "path": "p00-secret-security/secret-defaults.log",
          "sha256": "b00a66adabb2f436b36322923878511cbc184518a42e7b2e0f88c2b3469040e1"
        }
      ],
      "details": "Secret-default regression test passed; unsafe placeholder or hard-coded production defaults remain rejected by startup and source gates."
    }
  ]
}
