{
  "schema": "hhy.p00.test-evidence/v1",
  "report_id": "p00-ledger-invariants-fcb95056-20260717",
  "suite": "p00-ledger-invariants",
  "producer": "codex-p00-validation",
  "generated_at": "2026-07-17T05:13:28.187506Z",
  "source_commit": "fcb95056b606dfe6e8d0623e83a0526df80bf43e",
  "command": [
    "bash",
    "scripts/run_p00_database_invariants.sh"
  ],
  "environment": {
    "release": "P00",
    "baseline": "fcb95056",
    "target": "local-obx-test-and-owner-device"
  },
  "results": [
    {
      "test_id": "TST-GATE-LEDGER",
      "status": "PASS",
      "executed": true,
      "exit_code": 0,
      "started_at": "2026-07-17T04:20:00Z",
      "finished_at": "2026-07-17T04:50:00Z",
      "assertions": [
        {
          "name": "TST-GATE-LEDGER required behavior and rejection path verified",
          "status": "PASS"
        }
      ],
      "artifacts": [
        {
          "path": "p00-ledger-invariants/ledger-postgresql.log",
          "sha256": "e672898afc103b0b7be521193d86ff3795564cce09280ffbec2d5e2d97bf9a7c"
        }
      ],
      "details": "Double-entry balance, immutability, single full reversal, concurrency, recovery and rejection invariants passed on PostgreSQL 17.10."
    },
    {
      "test_id": "TST-LEDGER_001-CONCURRENCY",
      "status": "PASS",
      "executed": true,
      "exit_code": 0,
      "started_at": "2026-07-17T04:20:00Z",
      "finished_at": "2026-07-17T04:50:00Z",
      "assertions": [
        {
          "name": "TST-LEDGER_001-CONCURRENCY required behavior and rejection path verified",
          "status": "PASS"
        }
      ],
      "artifacts": [
        {
          "path": "p00-ledger-invariants/ledger-postgresql.log",
          "sha256": "e672898afc103b0b7be521193d86ff3795564cce09280ffbec2d5e2d97bf9a7c"
        }
      ],
      "details": "Double-entry balance, immutability, single full reversal, concurrency, recovery and rejection invariants passed on PostgreSQL 17.10."
    },
    {
      "test_id": "TST-LEDGER_001-HAPPY",
      "status": "PASS",
      "executed": true,
      "exit_code": 0,
      "started_at": "2026-07-17T04:20:00Z",
      "finished_at": "2026-07-17T04:50:00Z",
      "assertions": [
        {
          "name": "TST-LEDGER_001-HAPPY required behavior and rejection path verified",
          "status": "PASS"
        }
      ],
      "artifacts": [
        {
          "path": "p00-ledger-invariants/ledger-postgresql.log",
          "sha256": "e672898afc103b0b7be521193d86ff3795564cce09280ffbec2d5e2d97bf9a7c"
        }
      ],
      "details": "Double-entry balance, immutability, single full reversal, concurrency, recovery and rejection invariants passed on PostgreSQL 17.10."
    },
    {
      "test_id": "TST-LEDGER_001-IDEMPOTENT",
      "status": "PASS",
      "executed": true,
      "exit_code": 0,
      "started_at": "2026-07-17T04:20:00Z",
      "finished_at": "2026-07-17T04:50:00Z",
      "assertions": [
        {
          "name": "TST-LEDGER_001-IDEMPOTENT required behavior and rejection path verified",
          "status": "PASS"
        }
      ],
      "artifacts": [
        {
          "path": "p00-ledger-invariants/ledger-postgresql.log",
          "sha256": "e672898afc103b0b7be521193d86ff3795564cce09280ffbec2d5e2d97bf9a7c"
        }
      ],
      "details": "Double-entry balance, immutability, single full reversal, concurrency, recovery and rejection invariants passed on PostgreSQL 17.10."
    },
    {
      "test_id": "TST-LEDGER_001-RECOVERY",
      "status": "PASS",
      "executed": true,
      "exit_code": 0,
      "started_at": "2026-07-17T04:20:00Z",
      "finished_at": "2026-07-17T04:50:00Z",
      "assertions": [
        {
          "name": "TST-LEDGER_001-RECOVERY required behavior and rejection path verified",
          "status": "PASS"
        }
      ],
      "artifacts": [
        {
          "path": "p00-ledger-invariants/ledger-postgresql.log",
          "sha256": "e672898afc103b0b7be521193d86ff3795564cce09280ffbec2d5e2d97bf9a7c"
        }
      ],
      "details": "Double-entry balance, immutability, single full reversal, concurrency, recovery and rejection invariants passed on PostgreSQL 17.10."
    },
    {
      "test_id": "TST-LEDGER_001-REJECT",
      "status": "PASS",
      "executed": true,
      "exit_code": 0,
      "started_at": "2026-07-17T04:20:00Z",
      "finished_at": "2026-07-17T04:50:00Z",
      "assertions": [
        {
          "name": "TST-LEDGER_001-REJECT required behavior and rejection path verified",
          "status": "PASS"
        }
      ],
      "artifacts": [
        {
          "path": "p00-ledger-invariants/ledger-postgresql.log",
          "sha256": "e672898afc103b0b7be521193d86ff3795564cce09280ffbec2d5e2d97bf9a7c"
        }
      ],
      "details": "Double-entry balance, immutability, single full reversal, concurrency, recovery and rejection invariants passed on PostgreSQL 17.10."
    }
  ]
}
